{
  "$schema": "http://json-schema.org/draft-07/schema#",
  "title": "Federal outlays by category",
  "description": "Section three: the donut. Every dollar the federal government spent in one year, split into slices that do not overlap. The slices must sum to totalOutlays, and totalOutlays must match the federal-spending card in receipt.json. Both rules are enforced in scripts/lib/validate.mjs.",
  "type": "object",
  "required": ["meta", "fiscalYear", "totalOutlays", "categories"],
  "additionalProperties": false,
  "definitions": {
    "link": {
      "type": "object",
      "required": ["label", "url"],
      "additionalProperties": false,
      "properties": {
        "label": { "type": "string", "minLength": 1 },
        "url": { "type": "string", "format": "uri" }
      }
    },
    "source": {
      "description": "One publisher, or several. A slice note states the Treasury amount and then what that money buys against what it used to buy, so it usually names more than one page. Rendered in order, separated by a middle dot.",
      "oneOf": [
        { "$ref": "#/definitions/link" },
        { "type": "array", "minItems": 1, "items": { "$ref": "#/definitions/link" } }
      ]
    }
  },
  "properties": {
    "$schema": { "type": "string" },
    "meta": { "$ref": "meta.schema.json" },
    "fiscalYear": { "type": "integer", "minimum": 2000 },
    "totalOutlays": {
      "type": "number",
      "exclusiveMinimum": 0,
      "description": "Total outlays for the year, in dollars. The slices must add up to this."
    },
    "categories": {
      "type": "array",
      "minItems": 2,
      "description": "Rendered in this order, largest first. The order also picks each slice's color.",
      "items": {
        "type": "object",
        "required": ["id", "name", "amount", "note"],
        "additionalProperties": false,
        "properties": {
          "id": { "type": "string", "pattern": "^[a-z0-9-]+$" },
          "name": {
            "type": "string",
            "minLength": 1,
            "description": "Plain words for what the money does, not the agency's own title."
          },
          "agency": {
            "type": "string",
            "minLength": 1,
            "description": "The line as Treasury prints it, so a reader can find it in the source."
          },
          "amount": { "type": "number", "description": "Dollars. May be negative only inside a combined slice." },
          "note": {
            "type": "string",
            "minLength": 1,
            "description": "What the money does, then what it costs now against what it cost before. A slice that only names the job argues the other side's case."
          },
          "source": { "$ref": "#/definitions/source" }
        }
      }
    }
  }
}
